aiter/configs/a8w8_tuned_batched_gemm.csv
B,M,N,K,kernelId,splitK,us,kernelName
16,1,1280,8192,33,0,36.2168,a8w8_batched_rowwise_256x16x128x256_16x16_1x2_16x16x1_16x16x1_1x16x1x16_8x8x1_1x2_intrawave_v3
16,32,1280,8192,28,0,42.5095,a8w8_batched_rowwise_256x32x128x256_32x32_1x1_16x16x1_16x16x1_1x32x1x8_8x8x1_1x1_intrawave_v3
16,64,1280,8192,21,0,53.7518,a8w8_batched_rowwise_256x64x128x256_32x32_1x2_16x16x1_16x16x1_1x32x1x8_8x8x1_1x1_intrawave_v3
16,128,1280,8192,12,0,81.5091,a8w8_batched_rowwise_256x128x128x256_32x32_2x2_16x16x1_16x16x1_1x32x1x8_8x8x1_1x1_intrawave_v3
16,192,1280,8192,17,0,112.8771,a8w8_batched_rowwise_256x64x224x128_16x16_2x7_8x32x1_8x32x1_1x64x1x4_8x8x1_2x1_intrawave_v3
16,256,1280,8192,11,0,128.501,a8w8_batched_rowwise_256x128x160x128_32x32_1x5_8x32x1_8x32x1_1x64x1x4_8x8x1_1x1_intrawave_v3
16,320,1280,8192,8,0,175.3971,a8w8_batched_rowwise_256x128x256x128_32x32_2x4_8x32x1_8x32x1_1x32x1x8_8x8x1_1x1_intrawave_v3
16,512,1280,8192,4,0,217.8527,a8w8_batched_rowwise_256x256x160x128_32x32_2x5_8x32x1_8x32x1_1x64x1x4_8x8x1_2x1_intrawave_v3
16,1024,1280,8192,12,0,471.3916,a8w8_batched_rowwise_256x128x128x256_32x32_2x2_16x16x1_16x16x1_1x32x1x8_8x8x1_1x1_intrawave_v3
16,2048,1280,8192,3,0,837.144,a8w8_batched_rowwise_256x256x192x128_32x32_4x3_8x32x1_8x32x1_1x32x1x8_8x8x1_1x1_intrawave_v3
16,4096,1280,8192,1,0,1570.8443,a8w8_batched_rowwise_256x256x256x128_32x32_4x4_8x32x1_8x32x1_1x32x1x8_8x8x1_1x1_intrawave_v3
16,8192,1280,8192,1,0,2997.3704,a8w8_batched_rowwise_256x256x256x128_32x32_4x4_8x32x1_8x32x1_1x32x1x8_8x8x1_1x1_intrawave_v3
16,16384,1280,8192,1,0,5895.014,a8w8_batched_rowwise_256x256x256x128_32x32_4x4_8x32x1_8x32x1_1x32x1x8_8x8x1_1x1_intrawave_v3
16,1,8192,1024,69,0,29.6554,a8w8_batched_rowwise_128x16x32x128_16x16_1x1_8x16x1_8x16x1_1x16x1x8_4x4x1_1x1_interwave_v1
16,32,8192,1024,62,0,35.6425,a8w8_batched_rowwise_128x32x64x128_32x32_1x1_8x16x1_8x16x1_1x16x1x8_8x8x1_1x1_intrawave_v2
16,64,8192,1024,47,0,46.5034,a8w8_batched_rowwise_256x64x64x128_32x32_1x1_8x32x1_8x32x1_1x32x1x8_8x8x1_1x1_intrawave_v3
16,128,8192,1024,13,0,70.0771,a8w8_batched_rowwise_256x128x128x128_32x32_2x2_8x32x1_8x32x1_1x32x1x8_8x8x1_1x1_intrawave_v3
16,192,8192,1024,19,0,100.9708,a8w8_batched_rowwise_256x64x192x128_32x32_1x3_8x32x1_8x32x1_1x32x1x8_8x8x1_1x1_intrawave_v3
16,256,8192,1024,2,0,117.9798,a8w8_batched_rowwise_256x256x224x128_32x32_2x7_8x32x1_8x32x1_1x64x1x4_8x8x1_2x1_intrawave_v3
16,320,8192,1024,13,0,151.5056,a8w8_batched_rowwise_256x128x128x128_32x32_2x2_8x32x1_8x32x1_1x32x1x8_8x8x1_1x1_intrawave_v3
16,512,8192,1024,13,0,225.7097,a8w8_batched_rowwise_256x128x128x128_32x32_2x2_8x32x1_8x32x1_1x32x1x8_8x8x1_1x1_intrawave_v3
16,1024,8192,1024,13,0,442.9416,a8w8_batched_rowwise_256x128x128x128_32x32_2x2_8x32x1_8x32x1_1x32x1x8_8x8x1_1x1_intrawave_v3
16,2048,8192,1024,13,0,856.9159,a8w8_batched_rowwise_256x128x128x128_32x32_2x2_8x32x1_8x32x1_1x32x1x8_8x8x1_1x1_intrawave_v3
16,4096,8192,1024,1,0,1660.3101,a8w8_batched_rowwise_256x256x256x128_32x32_4x4_8x32x1_8x32x1_1x32x1x8_8x8x1_1x1_intrawave_v3
16,8192,8192,1024,43,0,3306.1776,a8w8_batched_rowwise_256x256x128x64_32x32_4x2_4x64x1_4x64x1_1x32x1x8_8x8x1_1x1_interwave_v1
