aiter/configs/a8w8_blockscale_tuned_gemm.csv
M,N,K,kernelId,splitK,us,kernelName
16,1536,7168,8,0,19.4246,a8w8_blockscale_1x128x128_256x16x64x256_16x16_16x16_16x16x1_16x16x1_1x16x1x16_4_1x1_intrawave_v1
16,3072,1536,8,0,6.3894,a8w8_blockscale_1x128x128_256x16x64x256_16x16_16x16_16x16x1_16x16x1_1x16x1x16_4_1x1_intrawave_v1
16,576,7168,8,0,19.3458,a8w8_blockscale_1x128x128_256x16x64x256_16x16_16x16_16x16x1_16x16x1_1x16x1x16_4_1x1_intrawave_v1
16,7168,256,8,0,3.7914,a8w8_blockscale_1x128x128_256x16x64x256_16x16_16x16_16x16x1_16x16x1_1x16x1x16_4_1x1_intrawave_v1
16,7168,2048,7,0,10.947,a8w8_blockscale_1x128x128_256x16x128x256_16x16_16x16_16x16x1_16x16x1_1x16x1x16_8_1x2_intrawave_v1
16,4608,7168,8,0,19.9315,a8w8_blockscale_1x128x128_256x16x64x256_16x16_16x16_16x16x1_16x16x1_1x16x1x16_4_1x1_intrawave_v1
16,7168,2304,8,0,11.3226,a8w8_blockscale_1x128x128_256x16x64x256_16x16_16x16_16x16x1_16x16x1_1x16x1x16_4_1x1_intrawave_v1
16,512,7168,8,0,19.4527,a8w8_blockscale_1x128x128_256x16x64x256_16x16_16x16_16x16x1_16x16x1_1x16x1x16_4_1x1_intrawave_v1
16,4096,512,8,0,4.0618,a8w8_blockscale_1x128x128_256x16x64x256_16x16_16x16_16x16x1_16x16x1_1x16x1x16_4_1x1_intrawave_v1
32,1536,7168,8,0,19.927,a8w8_blockscale_1x128x128_256x16x64x256_16x16_16x16_16x16x1_16x16x1_1x16x1x16_4_1x1_intrawave_v1
32,3072,1536,13,0,7.799,a8w8_blockscale_1x128x128_256x32x64x256_16x16_16x16_16x16x1_16x16x1_1x32x1x8_8_2x1_intrawave_v1
32,576,7168,8,0,19.8035,a8w8_blockscale_1x128x128_256x16x64x256_16x16_16x16_16x16x1_16x16x1_1x16x1x16_4_1x1_intrawave_v1
32,7168,256,13,0,4.8474,a8w8_blockscale_1x128x128_256x32x64x256_16x16_16x16_16x16x1_16x16x1_1x32x1x8_8_2x1_intrawave_v1
32,7168,2048,12,0,13.5078,a8w8_blockscale_1x128x128_256x32x128x256_16x16_32x32_16x16x1_16x16x1_1x32x1x8_8_1x1_intrawave_v1
32,4608,7168,7,0,27.3435,a8w8_blockscale_1x128x128_256x16x128x256_16x16_16x16_16x16x1_16x16x1_1x16x1x16_8_1x2_intrawave_v1
32,7168,2304,12,0,14.359,a8w8_blockscale_1x128x128_256x32x128x256_16x16_32x32_16x16x1_16x16x1_1x32x1x8_8_1x1_intrawave_v1
32,512,7168,8,0,19.7747,a8w8_blockscale_1x128x128_256x16x64x256_16x16_16x16_16x16x1_16x16x1_1x16x1x16_4_1x1_intrawave_v1
32,4096,512,13,0,4.7998,a8w8_blockscale_1x128x128_256x32x64x256_16x16_16x16_16x16x1_16x16x1_1x32x1x8_8_2x1_intrawave_v1
64,1536,7168,13,0,25.3771,a8w8_blockscale_1x128x128_256x32x64x256_16x16_16x16_16x16x1_16x16x1_1x32x1x8_8_2x1_intrawave_v1
64,3072,1536,18,0,10.1946,a8w8_blockscale_1x128x128_256x64x64x256_16x16_32x32_16x16x1_16x16x1_1x32x1x8_8_1x1_intrawave_v1
64,576,7168,8,0,19.875,a8w8_blockscale_1x128x128_256x16x64x256_16x16_16x16_16x16x1_16x16x1_1x16x1x16_4_1x1_intrawave_v1
64,7168,256,16,0,6.443,a8w8_blockscale_1x128x128_256x64x64x128_16x16_32x32_8x32x1_8x32x1_1x32x1x8_8_1x1_intrawave_v1
64,7168,2048,18,0,18.4746,a8w8_blockscale_1x128x128_256x64x64x256_16x16_32x32_16x16x1_16x16x1_1x32x1x8_8_1x1_intrawave_v1
64,4608,7168,18,0,31.0863,a8w8_blockscale_1x128x128_256x64x64x256_16x16_32x32_16x16x1_16x16x1_1x32x1x8_8_1x1_intrawave_v1
64,7168,2304,18,0,19.2478,a8w8_blockscale_1x128x128_256x64x64x256_16x16_32x32_16x16x1_16x16x1_1x32x1x8_8_1x1_intrawave_v1
64,512,7168,8,0,19.8418,a8w8_blockscale_1x128x128_256x16x64x256_16x16_16x16_16x16x1_16x16x1_1x16x1x16_4_1x1_intrawave_v1
64,4096,512,3,0,6.4018,a8w8_blockscale_1x128x128_256x64x64x128_16x16_32x32_8x32x1_8x32x1_1x32x1x8_8_1x1_intrawave_v3
128,1536,7168,18,0,31.0711,a8w8_blockscale_1x128x128_256x64x64x256_16x16_32x32_16x16x1_16x16x1_1x32x1x8_8_1x1_intrawave_v1
128,3072,1536,3,0,14.4742,a8w8_blockscale_1x128x128_256x64x64x128_16x16_32x32_8x32x1_8x32x1_1x32x1x8_8_1x1_intrawave_v3
128,576,7168,8,0,20.0614,a8w8_blockscale_1x128x128_256x16x64x256_16x16_16x16_16x16x1_16x16x1_1x16x1x16_4_1x1_intrawave_v1
128,7168,256,16,0,9.2646,a8w8_blockscale_1x128x128_256x64x64x128_16x16_32x32_8x32x1_8x32x1_1x32x1x8_8_1x1_intrawave_v1
128,7168,2048,18,0,27.5911,a8w8_blockscale_1x128x128_256x64x64x256_16x16_32x32_16x16x1_16x16x1_1x32x1x8_8_1x1_intrawave_v1
128,4608,7168,18,0,48.6159,a8w8_blockscale_1x128x128_256x64x64x256_16x16_32x32_16x16x1_16x16x1_1x32x1x8_8_1x1_intrawave_v1
128,7168,2304,3,0,27.7587,a8w8_blockscale_1x128x128_256x64x64x128_16x16_32x32_8x32x1_8x32x1_1x32x1x8_8_1x1_intrawave_v3
128,512,7168,8,0,20.0222,a8w8_blockscale_1x128x128_256x16x64x256_16x16_16x16_16x16x1_16x16x1_1x16x1x16_4_1x1_intrawave_v1
128,4096,512,16,0,9.4706,a8w8_blockscale_1x128x128_256x64x64x128_16x16_32x32_8x32x1_8x32x1_1x32x1x8_8_1x1_intrawave_v1
256,1536,7168,18,0,48.0159,a8w8_blockscale_1x128x128_256x64x64x256_16x16_32x32_16x16x1_16x16x1_1x32x1x8_8_1x1_intrawave_v1
256,3072,1536,3,0,20.4438,a8w8_blockscale_1x128x128_256x64x64x128_16x16_32x32_8x32x1_8x32x1_1x32x1x8_8_1x1_intrawave_v3
256,576,7168,13,0,25.5535,a8w8_blockscale_1x128x128_256x32x64x256_16x16_16x16_16x16x1_16x16x1_1x32x1x8_8_2x1_intrawave_v1
256,7168,256,16,0,14.019,a8w8_blockscale_1x128x128_256x64x64x128_16x16_32x32_8x32x1_8x32x1_1x32x1x8_8_1x1_intrawave_v1
256,7168,2048,2,0,46.1811,a8w8_blockscale_1x128x128_256x64x128x128_16x16_32x32_8x32x1_8x32x1_1x32x1x8_8_1x1_intrawave_v3
256,4608,7168,2,0,89.5716,a8w8_blockscale_1x128x128_256x64x128x128_16x16_32x32_8x32x1_8x32x1_1x32x1x8_8_1x1_intrawave_v3
256,7168,2304,3,0,49.7975,a8w8_blockscale_1x128x128_256x64x64x128_16x16_32x32_8x32x1_8x32x1_1x32x1x8_8_1x1_intrawave_v3
256,512,7168,13,0,25.4523,a8w8_blockscale_1x128x128_256x32x64x256_16x16_16x16_16x16x1_16x16x1_1x32x1x8_8_2x1_intrawave_v1
256,4096,512,2,0,14.0618,a8w8_blockscale_1x128x128_256x64x128x128_16x16_32x32_8x32x1_8x32x1_1x32x1x8_8_1x1_intrawave_v3
512,1536,7168,18,0,75.9904,a8w8_blockscale_1x128x128_256x64x64x256_16x16_32x32_16x16x1_16x16x1_1x32x1x8_8_1x1_intrawave_v1
512,3072,1536,3,0,32.1807,a8w8_blockscale_1x128x128_256x64x64x128_16x16_32x32_8x32x1_8x32x1_1x32x1x8_8_1x1_intrawave_v3
512,576,7168,18,0,31.4631,a8w8_blockscale_1x128x128_256x64x64x256_16x16_32x32_16x16x1_16x16x1_1x32x1x8_8_1x1_intrawave_v1
512,7168,256,16,0,23.9571,a8w8_blockscale_1x128x128_256x64x64x128_16x16_32x32_8x32x1_8x32x1_1x32x1x8_8_1x1_intrawave_v1
512,7168,2048,2,0,84.9144,a8w8_blockscale_1x128x128_256x64x128x128_16x16_32x32_8x32x1_8x32x1_1x32x1x8_8_1x1_intrawave_v3
512,4608,7168,2,0,161.569,a8w8_blockscale_1x128x128_256x64x128x128_16x16_32x32_8x32x1_8x32x1_1x32x1x8_8_1x1_intrawave_v3
512,7168,2304,2,0,90.31,a8w8_blockscale_1x128x128_256x64x128x128_16x16_32x32_8x32x1_8x32x1_1x32x1x8_8_1x1_intrawave_v3
512,512,7168,18,0,31.4115,a8w8_blockscale_1x128x128_256x64x64x256_16x16_32x32_16x16x1_16x16x1_1x32x1x8_8_1x1_intrawave_v1
512,4096,512,3,0,21.8851,a8w8_blockscale_1x128x128_256x64x64x128_16x16_32x32_8x32x1_8x32x1_1x32x1x8_8_1x1_intrawave_v3
1024,1536,7168,18,0,121.7549,a8w8_blockscale_1x128x128_256x64x64x256_16x16_32x32_16x16x1_16x16x1_1x32x1x8_8_1x1_intrawave_v1
1024,3072,1536,2,0,59.7275,a8w8_blockscale_1x128x128_256x64x128x128_16x16_32x32_8x32x1_8x32x1_1x32x1x8_8_1x1_intrawave_v3
1024,576,7168,18,0,49.1011,a8w8_blockscale_1x128x128_256x64x64x256_16x16_32x32_16x16x1_16x16x1_1x32x1x8_8_1x1_intrawave_v1
1024,7168,256,16,0,41.9815,a8w8_blockscale_1x128x128_256x64x64x128_16x16_32x32_8x32x1_8x32x1_1x32x1x8_8_1x1_intrawave_v1
1024,7168,2048,2,0,165.671,a8w8_blockscale_1x128x128_256x64x128x128_16x16_32x32_8x32x1_8x32x1_1x32x1x8_8_1x1_intrawave_v3
1024,4608,7168,2,0,317.4746,a8w8_blockscale_1x128x128_256x64x128x128_16x16_32x32_8x32x1_8x32x1_1x32x1x8_8_1x1_intrawave_v3
1024,7168,2304,3,0,175.3202,a8w8_blockscale_1x128x128_256x64x64x128_16x16_32x32_8x32x1_8x32x1_1x32x1x8_8_1x1_intrawave_v3
1024,512,7168,18,0,48.4499,a8w8_blockscale_1x128x128_256x64x64x256_16x16_32x32_16x16x1_16x16x1_1x32x1x8_8_1x1_intrawave_v1
1024,4096,512,16,0,37.3275,a8w8_blockscale_1x128x128_256x64x64x128_16x16_32x32_8x32x1_8x32x1_1x32x1x8_8_1x1_intrawave_v1
1536,1536,7168,2,0,162.9982,a8w8_blockscale_1x128x128_256x64x128x128_16x16_32x32_8x32x1_8x32x1_1x32x1x8_8_1x1_intrawave_v3
1536,3072,1536,3,0,88.3156,a8w8_blockscale_1x128x128_256x64x64x128_16x16_32x32_8x32x1_8x32x1_1x32x1x8_8_1x1_intrawave_v3
1536,576,7168,18,0,76.2496,a8w8_blockscale_1x128x128_256x64x64x256_16x16_32x32_16x16x1_16x16x1_1x32x1x8_8_1x1_intrawave_v1
1536,7168,256,16,0,59.7435,a8w8_blockscale_1x128x128_256x64x64x128_16x16_32x32_8x32x1_8x32x1_1x32x1x8_8_1x1_intrawave_v1
1536,7168,2048,2,0,237.0036,a8w8_blockscale_1x128x128_256x64x128x128_16x16_32x32_8x32x1_8x32x1_1x32x1x8_8_1x1_intrawave_v3
1536,4608,7168,2,0,450.6713,a8w8_blockscale_1x128x128_256x64x128x128_16x16_32x32_8x32x1_8x32x1_1x32x1x8_8_1x1_intrawave_v3
1536,7168,2304,2,0,253.8764,a8w8_blockscale_1x128x128_256x64x128x128_16x16_32x32_8x32x1_8x32x1_1x32x1x8_8_1x1_intrawave_v3
1536,512,7168,18,0,75.9592,a8w8_blockscale_1x128x128_256x64x64x256_16x16_32x32_16x16x1_16x16x1_1x32x1x8_8_1x1_intrawave_v1
1536,4096,512,3,0,54.9919,a8w8_blockscale_1x128x128_256x64x64x128_16x16_32x32_8x32x1_8x32x1_1x32x1x8_8_1x1_intrawave_v3
2048,1536,7168,2,0,212.3527,a8w8_blockscale_1x128x128_256x64x128x128_16x16_32x32_8x32x1_8x32x1_1x32x1x8_8_1x1_intrawave_v3
2048,3072,1536,2,0,113.2165,a8w8_blockscale_1x128x128_256x64x128x128_16x16_32x32_8x32x1_8x32x1_1x32x1x8_8_1x1_intrawave_v3
2048,576,7168,2,0,87.9612,a8w8_blockscale_1x128x128_256x64x128x128_16x16_32x32_8x32x1_8x32x1_1x32x1x8_8_1x1_intrawave_v3
2048,7168,256,16,0,77.4816,a8w8_blockscale_1x128x128_256x64x64x128_16x16_32x32_8x32x1_8x32x1_1x32x1x8_8_1x1_intrawave_v1
2048,7168,2048,2,0,317.2466,a8w8_blockscale_1x128x128_256x64x128x128_16x16_32x32_8x32x1_8x32x1_1x32x1x8_8_1x1_intrawave_v3
2048,4608,7168,2,0,606.9813,a8w8_blockscale_1x128x128_256x64x128x128_16x16_32x32_8x32x1_8x32x1_1x32x1x8_8_1x1_intrawave_v3
2048,7168,2304,3,0,338.8351,a8w8_blockscale_1x128x128_256x64x64x128_16x16_32x32_8x32x1_8x32x1_1x32x1x8_8_1x1_intrawave_v3
2048,512,7168,2,0,81.9908,a8w8_blockscale_1x128x128_256x64x128x128_16x16_32x32_8x32x1_8x32x1_1x32x1x8_8_1x1_intrawave_v3
2048,4096,512,16,0,70.4172,a8w8_blockscale_1x128x128_256x64x64x128_16x16_32x32_8x32x1_8x32x1_1x32x1x8_8_1x1_intrawave_v1
4096,1536,7168,2,0,402.536,a8w8_blockscale_1x128x128_256x64x128x128_16x16_32x32_8x32x1_8x32x1_1x32x1x8_8_1x1_intrawave_v3
4096,3072,1536,3,0,220.7904,a8w8_blockscale_1x128x128_256x64x64x128_16x16_32x32_8x32x1_8x32x1_1x32x1x8_8_1x1_intrawave_v3
4096,576,7168,2,0,172.5742,a8w8_blockscale_1x128x128_256x64x128x128_16x16_32x32_8x32x1_8x32x1_1x32x1x8_8_1x1_intrawave_v3
4096,7168,256,16,0,149.649,a8w8_blockscale_1x128x128_256x64x64x128_16x16_32x32_8x32x1_8x32x1_1x32x1x8_8_1x1_intrawave_v1
4096,7168,2048,2,0,619.029,a8w8_blockscale_1x128x128_256x64x128x128_16x16_32x32_8x32x1_8x32x1_1x32x1x8_8_1x1_intrawave_v3
4096,4608,7168,2,0,1172.2924,a8w8_blockscale_1x128x128_256x64x128x128_16x16_32x32_8x32x1_8x32x1_1x32x1x8_8_1x1_intrawave_v3
4096,7168,2304,2,0,663.4679,a8w8_blockscale_1x128x128_256x64x128x128_16x16_32x32_8x32x1_8x32x1_1x32x1x8_8_1x1_intrawave_v3
4096,512,7168,2,0,158.9842,a8w8_blockscale_1x128x128_256x64x128x128_16x16_32x32_8x32x1_8x32x1_1x32x1x8_8_1x1_intrawave_v3
4096,4096,512,16,0,134.6393,a8w8_blockscale_1x128x128_256x64x64x128_16x16_32x32_8x32x1_8x32x1_1x32x1x8_8_1x1_intrawave_v1
8192,1536,7168,2,0,805.105,a8w8_blockscale_1x128x128_256x64x128x128_16x16_32x32_8x32x1_8x32x1_1x32x1x8_8_1x1_intrawave_v3
8192,3072,1536,3,0,430.6929,a8w8_blockscale_1x128x128_256x64x64x128_16x16_32x32_8x32x1_8x32x1_1x32x1x8_8_1x1_intrawave_v3
8192,576,7168,2,0,340.7579,a8w8_blockscale_1x128x128_256x64x128x128_16x16_32x32_8x32x1_8x32x1_1x32x1x8_8_1x1_intrawave_v3
8192,7168,256,16,0,293.9925,a8w8_blockscale_1x128x128_256x64x64x128_16x16_32x32_8x32x1_8x32x1_1x32x1x8_8_1x1_intrawave_v1
8192,7168,2048,2,0,1232.6365,a8w8_blockscale_1x128x128_256x64x128x128_16x16_32x32_8x32x1_8x32x1_1x32x1x8_8_1x1_intrawave_v3
8192,4608,7168,2,0,2352.2349,a8w8_blockscale_1x128x128_256x64x128x128_16x16_32x32_8x32x1_8x32x1_1x32x1x8_8_1x1_intrawave_v3
8192,7168,2304,2,0,1321.7627,a8w8_blockscale_1x128x128_256x64x128x128_16x16_32x32_8x32x1_8x32x1_1x32x1x8_8_1x1_intrawave_v3
8192,512,7168,2,0,291.7201,a8w8_blockscale_1x128x128_256x64x128x128_16x16_32x32_8x32x1_8x32x1_1x32x1x8_8_1x1_intrawave_v3
8192,4096,512,16,0,262.15,a8w8_blockscale_1x128x128_256x64x64x128_16x16_32x32_8x32x1_8x32x1_1x32x1x8_8_1x1_intrawave_v1
16384,1536,7168,2,0,1584.0766,a8w8_blockscale_1x128x128_256x64x128x128_16x16_32x32_8x32x1_8x32x1_1x32x1x8_8_1x1_intrawave_v3
16384,3072,1536,2,0,852.8383,a8w8_blockscale_1x128x128_256x64x128x128_16x16_32x32_8x32x1_8x32x1_1x32x1x8_8_1x1_intrawave_v3
16384,576,7168,18,0,670.6759,a8w8_blockscale_1x128x128_256x64x64x256_16x16_32x32_16x16x1_16x16x1_1x32x1x8_8_1x1_intrawave_v1
16384,7168,256,16,0,581.5456,a8w8_blockscale_1x128x128_256x64x64x128_16x16_32x32_8x32x1_8x32x1_1x32x1x8_8_1x1_intrawave_v1
16384,7168,2048,2,0,2456.8027,a8w8_blockscale_1x128x128_256x64x128x128_16x16_32x32_8x32x1_8x32x1_1x32x1x8_8_1x1_intrawave_v3
16384,4608,7168,2,0,4718.6563,a8w8_blockscale_1x128x128_256x64x128x128_16x16_32x32_8x32x1_8x32x1_1x32x1x8_8_1x1_intrawave_v3
16384,7168,2304,2,0,2638.6195,a8w8_blockscale_1x128x128_256x64x128x128_16x16_32x32_8x32x1_8x32x1_1x32x1x8_8_1x1_intrawave_v3
16384,512,7168,2,0,534.7103,a8w8_blockscale_1x128x128_256x64x128x128_16x16_32x32_8x32x1_8x32x1_1x32x1x8_8_1x1_intrawave_v3
16384,4096,512,16,0,515.5647,a8w8_blockscale_1x128x128_256x64x64x128_16x16_32x32_8x32x1_8x32x1_1x32x1x8_8_1x1_intrawave_v1
20480,1536,7168,2,0,1954.8342,a8w8_blockscale_1x128x128_256x64x128x128_16x16_32x32_8x32x1_8x32x1_1x32x1x8_8_1x1_intrawave_v3
20480,3072,1536,2,0,1063.7988,a8w8_blockscale_1x128x128_256x64x128x128_16x16_32x32_8x32x1_8x32x1_1x32x1x8_8_1x1_intrawave_v3
20480,576,7168,18,0,832.3255,a8w8_blockscale_1x128x128_256x64x64x256_16x16_32x32_16x16x1_16x16x1_1x32x1x8_8_1x1_intrawave_v1
20480,7168,256,16,0,726.03,a8w8_blockscale_1x128x128_256x64x64x128_16x16_32x32_8x32x1_8x32x1_1x32x1x8_8_1x1_intrawave_v1
20480,7168,2048,2,0,3075.1182,a8w8_blockscale_1x128x128_256x64x128x128_16x16_32x32_8x32x1_8x32x1_1x32x1x8_8_1x1_intrawave_v3
20480,4608,7168,2,0,5890.4539,a8w8_blockscale_1x128x128_256x64x128x128_16x16_32x32_8x32x1_8x32x1_1x32x1x8_8_1x1_intrawave_v3
20480,7168,2304,2,0,3292.9571,a8w8_blockscale_1x128x128_256x64x128x128_16x16_32x32_8x32x1_8x32x1_1x32x1x8_8_1x1_intrawave_v3
20480,512,7168,2,0,656.6522,a8w8_blockscale_1x128x128_256x64x128x128_16x16_32x32_8x32x1_8x32x1_1x32x1x8_8_1x1_intrawave_v3
20480,4096,512,16,0,643.5182,a8w8_blockscale_1x128x128_256x64x64x128_16x16_32x32_8x32x1_8x32x1_1x32x1x8_8_1x1_intrawave_v1
