ater/configs/a8w8_tuned_gemm.csv
M,N,K,kernelId,us,kernelName
1,1280,8192,34,19.4796,a8w8_rowwise_256x16x64x512_16x16_1x1_32x8x1_32x8x1_1x16x1x16_4x4x1_1x1_intrawave_v3
32,1280,8192,34,17.8572,a8w8_rowwise_256x16x64x512_16x16_1x1_32x8x1_32x8x1_1x16x1x16_4x4x1_1x1_intrawave_v3
64,1280,8192,34,18.0968,a8w8_rowwise_256x16x64x512_16x16_1x1_32x8x1_32x8x1_1x16x1x16_4x4x1_1x1_intrawave_v3
128,1280,8192,30,22.4268,a8w8_rowwise_256x32x64x512_16x16_1x2_32x8x1_32x8x1_1x32x1x8_8x8x1_1x2_intrawave_v3
192,1280,8192,23,31.8488,a8w8_rowwise_256x64x64x512_32x32_1x1_32x8x1_32x8x1_1x32x1x8_8x8x1_1x1_intrawave_v3
256,1280,8192,23,32.1232,a8w8_rowwise_256x64x64x512_32x32_1x1_32x8x1_32x8x1_1x32x1x8_8x8x1_1x1_intrawave_v3
320,1280,8192,15,52.7653,a8w8_rowwise_256x128x64x256_32x32_2x1_16x16x1_16x16x1_1x32x1x8_8x8x1_1x1_intrawave_v3
512,1280,8192,15,49.6605,a8w8_rowwise_256x128x64x256_32x32_2x1_16x16x1_16x16x1_1x32x1x8_8x8x1_1x1_intrawave_v3
1024,1280,8192,35,74.9413,a8w8_rowwise_256x128x128x128_32x32_2x2_8x32x1_8x32x1_1x32x1x8_8x8x1_1x1_intrawave_v4
2048,1280,8192,41,137.841,a8w8_rowwise_256x128x128x128_32x32_2x2_8x32x1_8x32x1_1x32x1x8_8x8x1_1x1_intrawave_v5
4096,1280,8192,0,243.1671,a8w8_rowwise_256x256x256x64_32x32_4x4_4x64x1_4x64x1_1x32x1x8_8x8x1_1x1_intrawave_v4
8192,1280,8192,0,483.5662,a8w8_rowwise_256x256x256x64_32x32_4x4_4x64x1_4x64x1_1x32x1x8_8x8x1_1x1_intrawave_v4
16384,1280,8192,0,964.3764,a8w8_rowwise_256x256x256x64_32x32_4x4_4x64x1_4x64x1_1x32x1x8_8x8x1_1x1_intrawave_v4
1,8192,1024,78,7.6764,a8w8_rowwise_64x16x16x128_16x16_1x1_8x8x1_8x8x1_1x16x1x4_4x4x1_1x1_interwave_v2
32,8192,1024,28,9.474,a8w8_rowwise_256x32x128x256_32x32_1x1_16x16x1_16x16x1_1x32x1x8_8x8x1_1x1_intrawave_v3
64,8192,1024,21,11.6736,a8w8_rowwise_256x64x128x256_32x32_1x2_16x16x1_16x16x1_1x32x1x8_8x8x1_1x1_intrawave_v3
128,8192,1024,45,17.012,a8w8_rowwise_256x128x64x128_32x32_2x1_8x32x1_8x32x1_1x32x1x8_8x8x1_1x1_intrawave_v3
192,8192,1024,47,22.0116,a8w8_rowwise_256x64x64x128_32x32_1x1_8x32x1_8x32x1_1x32x1x8_8x8x1_1x1_intrawave_v3
256,8192,1024,13,26.272,a8w8_rowwise_256x128x128x128_32x32_2x2_8x32x1_8x32x1_1x32x1x8_8x8x1_1x1_intrawave_v3
320,8192,1024,46,32.638,a8w8_rowwise_256x64x128x128_32x32_1x2_8x32x1_8x32x1_1x32x1x8_8x8x1_1x1_intrawave_v3
512,8192,1024,2,47.0873,a8w8_rowwise_256x256x224x128_32x32_2x7_8x32x1_8x32x1_1x64x1x4_8x8x1_2x1_intrawave_v3
1024,8192,1024,36,81.4333,a8w8_rowwise_256x128x128x64_32x32_2x2_4x64x1_4x64x1_1x32x1x8_8x8x1_1x1_intrawave_v4
2048,8192,1024,36,145.5726,a8w8_rowwise_256x128x128x64_32x32_2x2_4x64x1_4x64x1_1x32x1x8_8x8x1_1x1_intrawave_v4
4096,8192,1024,36,281.1375,a8w8_rowwise_256x128x128x64_32x32_2x2_4x64x1_4x64x1_1x32x1x8_8x8x1_1x1_intrawave_v4
8192,8192,1024,36,552.8627,a8w8_rowwise_256x128x128x64_32x32_2x2_4x64x1_4x64x1_1x32x1x8_8x8x1_1x1_intrawave_v4
16384,8192,1024,36,1092.6245,a8w8_rowwise_256x128x128x64_32x32_2x2_4x64x1_4x64x1_1x32x1x8_8x8x1_1x1_intrawave_v4
